{
  "schemaVersion": 1,
  "batchId": "fixture_canonical_v1",
  "destination": {
    "blockId": null,
    "blockPath": ["Import Test", "Vocabulary"],
    "createIfMissing": true
  },
  "entries": [
    {
      "entryId": "entry_responsible",
      "lemma": "responsible",
      "entryType": "word",
      "forms": [
        {
          "formId": "form_responsible_01",
          "written": "responsible",
          "morphology": null,
          "pronunciations": [
            {
              "pronunciationId": "pron_responsible_en_us_01",
              "locale": "en-US",
              "ipa": "/rɪˈspɑːnsəbəl/"
            }
          ]
        }
      ],
      "senses": [
        {
          "senseId": "sense_responsible_adjective_01",
          "pos": "adjective",
          "formId": "form_responsible_01",
          "pronunciationId": "pron_responsible_en_us_01",
          "glosses": [{"locale": "vi", "text": "chịu trách nhiệm; có trách nhiệm"}],
          "definition": "having the duty to take care of something or to make decisions about it",
          "examples": [
            {
              "exampleId": "ex_responsible_01",
              "type": "meaning",
              "en": "She is responsible for the safety of the children.",
              "note": null,
              "translations": [{"locale": "vi", "text": "Cô ấy chịu trách nhiệm về sự an toàn của những đứa trẻ."}]
            },
            {
              "exampleId": "ex_responsible_02",
              "type": "usage",
              "en": "Managers are responsible for making sure the work is completed on time.",
              "note": "Followed by 'for', then a noun or an -ing form.",
              "translations": [{"locale": "vi", "text": "Các quản lý có trách nhiệm đảm bảo công việc được hoàn thành đúng hạn."}]
            }
          ],
          "additional": {
            "schemaVersion": 1,
            "items": [
              {
                "id": "add_responsible_pattern_01",
                "kind": "pattern",
                "salience": 1,
                "text": "responsible for + noun / V-ing",
                "note": null,
                "target": null,
                "attributes": {"patternType": "complementation"}
              },
              {
                "id": "add_responsible_collocation_01",
                "kind": "collocation",
                "salience": 1,
                "text": "take responsibility for",
                "note": null,
                "target": null,
                "attributes": {"relation": "verb+noun"}
              },
              {
                "id": "add_responsible_relation_01",
                "kind": "relation",
                "salience": 2,
                "text": null,
                "note": "Accountable often emphasizes being answerable for a result.",
                "target": {"entryId": "entry_accountable", "senseId": null},
                "attributes": {"relationType": "near_synonym"}
              }
            ]
          }
        }
      ]
    },
    {
      "entryId": "entry_record",
      "lemma": "record",
      "entryType": "word",
      "forms": [
        {
          "formId": "form_record_01",
          "written": "record",
          "morphology": null,
          "pronunciations": [
            {"pronunciationId": "pron_record_noun_en_us", "locale": "en-US", "ipa": "/ˈrekərd/"},
            {"pronunciationId": "pron_record_verb_en_us", "locale": "en-US", "ipa": "/rɪˈkɔːrd/"}
          ]
        }
      ],
      "senses": [
        {
          "senseId": "sense_record_noun_01",
          "pos": "noun",
          "formId": "form_record_01",
          "pronunciationId": "pron_record_noun_en_us",
          "glosses": [{"locale": "vi", "text": "bản ghi; hồ sơ"}],
          "definition": "a written account of something that is kept so it can be looked at later",
          "examples": [
            {
              "exampleId": "ex_record_noun_01",
              "type": "meaning",
              "en": "The clinic keeps a record of every visit.",
              "note": null,
              "translations": [{"locale": "vi", "text": "Phòng khám lưu hồ sơ của mỗi lần khám."}]
            },
            {
              "exampleId": "ex_record_noun_02",
              "type": "usage",
              "en": "There is no record of the payment in our system.",
              "note": "Stress falls on the first syllable in the noun.",
              "translations": [{"locale": "vi", "text": "Không có bản ghi nào về khoản thanh toán trong hệ thống của chúng tôi."}]
            }
          ],
          "additional": {"schemaVersion": 1, "items": []}
        },
        {
          "senseId": "sense_record_verb_01",
          "pos": "verb",
          "formId": "form_record_01",
          "pronunciationId": "pron_record_verb_en_us",
          "glosses": [{"locale": "vi", "text": "ghi lại; thu âm"}],
          "definition": "to store sound, pictures or information so that it can be used later",
          "examples": [
            {
              "exampleId": "ex_record_verb_01",
              "type": "meaning",
              "en": "They recorded the lecture on a phone.",
              "note": null,
              "translations": [{"locale": "vi", "text": "Họ đã ghi âm bài giảng bằng điện thoại."}]
            },
            {
              "exampleId": "ex_record_verb_02",
              "type": "usage",
              "en": "Please record the temperature every morning.",
              "note": "Stress falls on the second syllable in the verb.",
              "translations": [{"locale": "vi", "text": "Hãy ghi lại nhiệt độ vào mỗi buổi sáng."}]
            }
          ],
          "additional": {
            "schemaVersion": 1,
            "items": [
              {
                "id": "add_record_verb_usage_01",
                "kind": "usage",
                "salience": 1,
                "text": null,
                "note": "The noun and the verb are spelled the same but stressed differently.",
                "target": null,
                "attributes": {"usageType": "other"}
              }
            ]
          }
        }
      ]
    },
    {
      "entryId": "entry_gradient_descent",
      "lemma": "gradient descent",
      "entryType": "phrase",
      "forms": [
        {
          "formId": "form_gradient_descent_01",
          "written": "gradient descent",
          "morphology": null,
          "pronunciations": [
            {"pronunciationId": "pron_gradient_descent_en_us_01", "locale": "en-US", "ipa": "/ˈɡreɪdiənt dɪˈsent/"}
          ]
        }
      ],
      "senses": [
        {
          "senseId": "sense_gradient_descent_noun_01",
          "pos": "noun",
          "formId": "form_gradient_descent_01",
          "pronunciationId": "pron_gradient_descent_en_us_01",
          "glosses": [{"locale": "vi", "text": "phương pháp hạ gradient"}],
          "definition": "a method that repeatedly adjusts values in the direction that most reduces an error",
          "examples": [
            {
              "exampleId": "ex_gradient_descent_01",
              "type": "meaning",
              "en": "Gradient descent slowly moves the model toward a lower error.",
              "note": null,
              "translations": [{"locale": "vi", "text": "Phương pháp hạ gradient dần đưa mô hình tới mức lỗi thấp hơn."}]
            },
            {
              "exampleId": "ex_gradient_descent_02",
              "type": "usage",
              "en": "We trained the network using stochastic gradient descent.",
              "note": "Usually uncountable, and often modified: batch, stochastic, mini-batch.",
              "translations": [{"locale": "vi", "text": "Chúng tôi huấn luyện mạng bằng phương pháp hạ gradient ngẫu nhiên."}]
            }
          ],
          "additional": {
            "schemaVersion": 1,
            "items": [
              {
                "id": "add_gradient_descent_usage_01",
                "kind": "usage",
                "salience": 1,
                "text": null,
                "note": "Uncountable: say 'use gradient descent', not 'use a gradient descent'.",
                "target": null,
                "attributes": {"usageType": "countability", "value": "uncountable"}
              },
              {
                "id": "add_gradient_descent_collocation_01",
                "kind": "collocation",
                "salience": 2,
                "text": "stochastic gradient descent",
                "note": null,
                "target": null,
                "attributes": {"relation": "adjective+noun"}
              }
            ]
          }
        }
      ]
    }
  ]
}
